{
  "$schema": "https://json-schema.org/draft/2020-12/schema",
  "$id": "https://bhashanboard.example/schema/statement.schema.json",
  "title": "Bhashan Board — statement corpus",
  "type": "object",
  "required": ["corpus", "version", "statements"],
  "properties": {
    "corpus": { "type": "string" },
    "version": { "type": "string" },
    "compiled": { "type": "string" },
    "$comment": { "type": "string" },
    "$schema": { "type": "string" },
    "statements": { "type": "array", "items": { "$ref": "#/$defs/statement" } }
  },
  "$defs": {
    "statement": {
      "type": "object",
      "additionalProperties": false,
      "allOf": [
        {
          "if": {
            "properties": {
              "language": { "not": { "const": "English" } },
              "quote": { "type": "string", "pattern": "\\S" }
            },
            "required": ["language", "quote"]
          },
          "then": { "required": ["quote_translation"] }
        },
        {
          "if": {
            "properties": { "quote": { "type": "null" } },
            "required": ["quote"]
          },
          "then": {
            "required": ["quote_note"],
            "not": { "required": ["quote_translation"] }
          }
        },
        {
          "if": {
            "properties": { "language": { "const": "English" } },
            "required": ["language"]
          },
          "then": { "not": { "required": ["quote_translation"] } }
        },
        {
          "if": {
            "properties": {
              "verification": {
                "properties": {
                  "stage": { "enum": ["av_verified", "committee_passed"] }
                },
                "required": ["stage"]
              }
            },
            "required": ["verification"]
          },
          "then": { "required": ["video"] }
        }
      ],
      "required": [
        "id", "status", "speaker_id", "party_at_time", "office_at_time", "state",
        "date", "date_precision", "venue", "language", "category",
        "neutral_title", "quote", "claim", "context", "axes", "verification"
      ],
      "properties": {
        "id": { "type": "string", "pattern": "^IN-[0-9]{4,}$" },

        "status": {
          "enum": ["published", "held_parity", "held_review", "withdrawn"],
          "description": "published — live only after the complete evidence/video bar passes; public rank still requires ten valid rulings. held_parity — legacy status retained for old imports and not a valid reason to hide a newly qualified record. held_review — a public research file whose evidence, context, duplication, or Committee question is open. withdrawn — retained in the audit record but removed from the public board. Private submission drafts are database-only and must never be committed to the seed corpus."
        },

        "speaker_id": { "type": "string", "description": "FK to politicians.json" },
        "party_at_time": { "type": "string", "description": "FK to parties.json. The party held ON THE DATE OF THE STATEMENT, not today. Defections make this load-bearing; the parity meter counts this field." },
        "office_at_time": { "type": "string" },
        "state": { "type": "string" },

        "date": { "type": "string", "pattern": "^[0-9]{4}(-[0-9]{2}(-[0-9]{2})?)?$" },
        "date_precision": { "enum": ["day", "month", "year"] },
        "venue": { "type": "string" },
        "language": { "type": "string" },

        "category": { "enum": ["Science & Reason", "History", "Economics", "Whataboutery", "Standing Ovation"] },

        "neutral_title": {
          "type": "string",
          "description": "States what was CLAIMED. Never a verdict about the person. 'On radar and cloud cover', never 'MP thinks clouds block radar'. Enforced in review, not just policy (docs/03-content-pipeline.md §3.3)."
        },

        "quote": {
          "type": ["string", "null"],
          "pattern": "\\S",
          "description": "ORIGINAL-LANGUAGE VERBATIM ONLY. Null if the exact wording has not been established from a source. Never put an English rendering of a non-English remark here, never paraphrase, never reconstruct it from reported speech, and never tidy the grammar. A null quote is a research task; an invented quote is the end of the project."
        },
        "quote_note": { "type": "string", "pattern": "\\S", "description": "Required whenever `quote` is null. For sourced quotes, record transcription or normalization decisions and remaining provenance work here." },
        "quote_translation": { "type": "string", "pattern": "\\S", "description": "Faithful English translation of a non-English verbatim quote. Required whenever a non-English `quote` is present." },

        "claim": { "type": "string", "description": "Neutral one-line summary of what was asserted. This is what search and the duel card render when `quote` is null." },
        "context": { "type": "string", "description": "What surrounds the statement. Stage 3 requires the surrounding 60s be watched; this field records what that showed." },
        "counterpoint": { "type": "string", "description": "The factual position, where the statement makes a checkable claim. Kept separate from the sarcasm layer." },

        "policy_note": { "type": "string", "description": "Required for any entry that engages a Rule in docs/04-legal-and-safety.md §4.8 without being rejected by it. Must record the ruling and the reasoning, not just the flag." },

        "video": { "$ref": "#/$defs/video" },

        "axes": {
          "type": "object",
          "additionalProperties": false,
          "required": ["logic_damage", "straight_face", "rewatch_value", "crowd_complicity", "consequence"],
          "properties": {
            "logic_damage":     { "$ref": "#/$defs/axisScore" },
            "straight_face":    { "$ref": "#/$defs/axisScore" },
            "rewatch_value":    { "$ref": "#/$defs/axisScore" },
            "crowd_complicity": { "$ref": "#/$defs/axisScore" },
            "consequence":      { "$ref": "#/$defs/axisScore" }
          },
          "description": "Internal research notes retained for audit and historical rubric continuity. They never establish public GP, tier, rank, or a starting advantage. Public performance is the arithmetic mean of equal-strength valid rulings. Aamne-Saamne exhibition picks never affect it."
        },

        "verification": {
          "type": "object",
          "additionalProperties": false,
          "required": ["stage", "best_source_tier", "sources"],
          "properties": {
            "stage": {
              "enum": ["text_sourced", "av_verified", "committee_passed"],
              "description": "text_sourced — attributed to a named person by at least one reputable outlet; NOT publishable. av_verified — Tier A/B clip located with a bounded timestamped excerpt and surrounding context watched. committee_passed — the full Stage 3 checklist signed off. Nothing publishes below committee_passed."
            },
            "best_source_tier": { "enum": ["A", "B", "C"] },
            "needs": { "type": "array", "items": { "type": "string" }, "description": "The specific outstanding work. This is the research queue; treat it as the to-do list, not as documentation." },
            "sources": {
              "type": "array",
              "minItems": 1,
              "maxItems": 4,
              "items": {
                "type": "object",
                "required": ["tier", "publisher", "title", "url"],
                "properties": {
                  "tier": { "enum": ["A", "B", "C"] },
                  "publisher": { "type": "string" },
                  "title": { "type": "string" },
                  "url": { "type": "string", "format": "uri" },
                  "role": {
                    "enum": ["footage", "reporting", "context", "fact_check"],
                    "description": "Optional provenance role. Social-platform footage remains a source citation; it does not become a vote-eligible video."
                  }
                }
              }
            }
          }
        }
      }
    },
    "video": {
      "oneOf": [
        {
          "type": "object",
          "additionalProperties": false,
          "required": ["platform", "id", "start", "end"],
          "properties": {
            "platform": { "const": "youtube" },
            "id": { "type": "string", "pattern": "^[A-Za-z0-9_-]{6,20}$" },
            "start": { "type": "integer", "minimum": 0, "maximum": 86400 },
            "end": { "type": "integer", "minimum": 1, "maximum": 86400 }
          }
        },
        {
          "type": "object",
          "additionalProperties": false,
          "required": [
            "platform", "id", "start", "end", "assetId", "version", "bytes", "derivedBytes", "format", "durationMs"
          ],
          "properties": {
            "platform": { "const": "cloudinary" },
            "id": {
              "type": "string",
              "pattern": "^bhashanboard/statement-videos/[0-9a-f]{8}-[0-9a-f]{4}-[1-5][0-9a-f]{3}-[89ab][0-9a-f]{3}-[0-9a-f]{12}$"
            },
            "assetId": { "type": "string", "pattern": "^[A-Za-z0-9_-]{16,128}$" },
            "version": { "type": "integer", "minimum": 1 },
            "start": { "const": 0 },
            "end": { "type": "integer", "minimum": 3, "maximum": 180 },
            "bytes": { "type": "integer", "minimum": 1, "maximum": 52428800 },
            "derivedBytes": { "type": "integer", "minimum": 1, "maximum": 104857600 },
            "format": { "const": "mp4" },
            "durationMs": { "type": "integer", "minimum": 3000, "maximum": 180000 }
          }
        }
      ],
      "description": "Canonical bounded evidence excerpt. YouTube remains externally embedded; rights-cleared Cloudinary uploads are authenticated assets with a verified, version-pinned MP4 derivative. Application validation enforces cross-field duration bounds."
    },
    "axisScore": { "type": "integer", "minimum": 0, "maximum": 5 }
  }
}
