{
  "$schema": "./schema/statement.schema.json",
  "corpus": "india",
  "version": "0.1.0",
  "compiled": "2026-07-26",
  "$comment": "SEED CORPUS — India. Read data/README.md before adding an entry. Two rules govern this file and nothing overrides them: (1) every statement is a real, publicly-reported, on-record remark by a public figure acting in a public role, carrying at least one live source link; (2) nothing here is paraphrased into the `quote` field — if the exact wording could not be established from a source, `quote` is null and `claim` carries a neutral summary instead. `stage` is the content-pipeline stage each entry has actually cleared (docs/03-content-pipeline.md §3.3). No entry in this file has cleared Stage 3; none is publishable as-is.",
  "statements": [
    {
      "id": "IN-0001",
      "status": "published",
      "speaker_id": "narendra-modi",
      "party_at_time": "BJP",
      "office_at_time": "Prime Minister of India",
      "state": "Delhi",
      "date": "2019-05-11",
      "date_precision": "day",
      "venue": "Television interview to News Nation",
      "language": "Hindi",
      "category": "Science & Reason",
      "neutral_title": "On cloud cover and radar",
      "quote": "लेकिन मैंने कहा कि बादल और बारिश से फायदा भी है। हम रडार से बच सकते हैं।",
      "quote_translation": "But I said that clouds and rain also have an advantage. We can evade radar.",
      "quote_note": "Original Hindi as quoted in ThePrint Hindi's report of the News Nation interview. The full interview still needs audiovisual timestamps and surrounding context.",
      "claim": "That cloud cover would reduce the chance of Indian aircraft being detected by Pakistani radar during the Balakot operation.",
      "context": "Modi described overruling expert hesitation on the night of the strike, calling the reasoning his 'raw wisdom'. The full interview is the context that must be captured before publication; the surrounding minutes are about the decision to proceed in poor weather.",
      "counterpoint": "Radar operates at wavelengths that pass through cloud largely unattenuated; cloud affects visual and some electro-optical targeting, not radar detection.",
      "axes": {
        "logic_damage": 5,
        "straight_face": 5,
        "rewatch_value": 5,
        "crowd_complicity": 2,
        "consequence": 5
      },
      "verification": {
        "stage": "text_sourced",
        "best_source_tier": "C",
        "needs": [
          "Tier A/B video of the News Nation interview with start/end timestamps",
          "surrounding 60 seconds transcribed and reviewed"
        ],
        "sources": [
          {
            "tier": "C",
            "publisher": "FactChecker.in",
            "title": "PM Twice Wrong: Clouds Do Not Hinder Radar, May Hinder Weapons",
            "url": "https://www.factchecker.in/pm-twice-wrong-clouds-do-not-hinder-radar-may-hinder-weapons"
          },
          {
            "tier": "C",
            "publisher": "The Quint",
            "title": "PM Modi Faces Ridicule on Social Media for Unusual Cloud Logic on Balakot Air Strikes",
            "url": "https://www.thequint.com/news/india/balakot-air-strikes-cloud-radar-pm-narendra-modi-interview"
          },
          {
            "tier": "C",
            "publisher": "Deccan Herald",
            "title": "Modi's cloud cover revelation draws opposition sneer",
            "url": "https://www.deccanherald.com/elections/modis-cloud-cover-revelation-draws-opposition-sneer-733502.html"
          },
          {
            "tier": "C",
            "publisher": "ThePrint Hindi",
            "title": "रडार तकनीक पर पीएम ने ज़ाहिर की अपनी अज्ञानता, इंटरव्यू में बालाकोट से जुड़ी अहम जानकारी सार्वजनिक की",
            "url": "https://hindi.theprint.in/politics/prime-minister-shows-ignorance-of-radar-tech-gives-out-crucial-details-of-balakot-raid-in-interview/61294/"
          }
        ]
      }
    },
    {
      "id": "IN-0002",
      "status": "published",
      "speaker_id": "narendra-modi",
      "party_at_time": "BJP",
      "office_at_time": "Prime Minister of India",
      "state": "Maharashtra",
      "date": "2014-10-25",
      "date_precision": "day",
      "venue": "Inauguration of Sir H. N. Reliance Foundation Hospital, Mumbai",
      "language": "Hindi",
      "category": "History",
      "neutral_title": "On Ganesha, Karna and the antiquity of surgery",
      "quote": "महाभारत का कहना है कि कर्ण मां की गोद से पैदा नहीं हुआ था, इसका मतलब ये हुआ कि उस समय Genetic Science मौजूद था। तभी तो कर्ण, मां की गोद के बिना उसका जन्म हुआ होगा। हम गणेश जी की पूजा करते हैं, कोई तो प्लास्टिक सर्जन होगा उस जमाने में, जिसने मनुष्य के शरीर पर हाथी का सर रख कर के प्लास्टिक सर्जरी का प्रारंभ हुआ होगा।",
      "quote_translation": "The Mahabharata says that Karna was not born from his mother's womb; this means genetic science existed at that time. That is how Karna could have been born without his mother's womb. We worship Lord Ganesha; there must have been a plastic surgeon in those days who put an elephant's head on a human body and began plastic surgery.",
      "quote_note": "Original Hindi from the speaker's published transcript. An invisible Unicode joiner in “प्लास्टिक” was normalized; official audiovisual footage and audience reaction remain outstanding.",
      "claim": "That reproductive genetics and plastic surgery were practised in ancient India, evidenced by episodes in the Mahabharata and by the iconography of Ganesha.",
      "context": "Said to an audience of doctors and medical scientists while opening a hospital.",
      "policy_note": "Borderline under Rule 1 (religion). Committee ruling: IN SCOPE. The claim under review is a claim about the history of medicine, made to doctors, in a hospital. The archive takes no position on the epics or on anyone's faith, and the entry must never be titled or captioned in a way that implies otherwise.",
      "axes": {
        "logic_damage": 5,
        "straight_face": 5,
        "rewatch_value": 4,
        "crowd_complicity": 4,
        "consequence": 5
      },
      "verification": {
        "stage": "text_sourced",
        "best_source_tier": "A",
        "needs": [
          "official audiovisual footage with start/end timestamps and surrounding 60 seconds",
          "verify whether the audience reaction is on the record (drives the Crowd Complicity axis)"
        ],
        "sources": [
          {
            "tier": "C",
            "publisher": "ThePrint",
            "title": "Vedic plastic surgery to test-tube Karna — non-science claims flowed from Modi downwards",
            "url": "https://theprint.in/science/vedic-plastic-surgery-to-test-tube-karna-non-science-claims-flowed-from-modi-downwards/174757/"
          },
          {
            "tier": "C",
            "publisher": "Quartz India",
            "title": "Modi was half-right: World's first plastic surgeon may well have been Indian",
            "url": "https://qz.com/india/288867/modi-was-half-right-worlds-first-plastic-surgeon-may-well-have-been-indian-but-he-wasnt-shiva"
          },
          {
            "tier": "C",
            "publisher": "Alt News",
            "title": "BJP and Science: From Ganesha's plastic surgery to 'Yoga can cure cancer'",
            "url": "https://www.altnews.in/bjp-science-ganeshas-plastic-surgery-yoga-can-cure-cancer/"
          },
          {
            "tier": "A",
            "publisher": "NarendraModi.in",
            "title": "Text of the PM's address at the ceremony held to rededicate Sir H. N. Reliance Foundation Hospital and Research Centre",
            "url": "https://www.narendramodi.in/text-of-the-prime-minister-shri-narendra-modis-address-at-the-ceremony-held-to-rededicate-sir-h-n-reliance-foundation-hospital-and-research-centre-in-mumbai-2-2880"
          }
        ]
      }
    },
    {
      "id": "IN-0003",
      "status": "published",
      "speaker_id": "satyapal-singh",
      "party_at_time": "BJP",
      "office_at_time": "Union Minister of State for Human Resource Development",
      "state": "Maharashtra",
      "date": "2018-01-19",
      "date_precision": "day",
      "venue": "All India Vedic Conference, Aurangabad",
      "language": "Hindi",
      "category": "Science & Reason",
      "neutral_title": "On whether evolution was witnessed",
      "quote": "ना तो हमारे पूर्वजों ने और ना ही किसी और ने कभी यह कहा या लिखा कि उन्होंने किसी बंदर को इंसान में परिवर्तित होते देखा।",
      "quote_translation": "Neither our ancestors nor anyone else ever said or wrote that they had seen an ape turn into a human.",
      "quote_note": "Original Hindi quoted by Aaj Tak and corroborated by NDTV's contemporaneous video page. A full event recording with surrounding context remains outstanding.",
      "claim": "That the theory of evolution is scientifically wrong and should be removed from school and university curricula, because no eyewitness account exists of an ape becoming a man.",
      "context": "Singh, a former Mumbai Police Commissioner, was then a junior minister for education. He repeated the position several times over the following weeks and challenged scientists to a debate.",
      "counterpoint": "Over 2,000 scientists from Indian research institutions signed a joint statement rejecting the remarks. Singh's senior colleague Prakash Javadekar publicly asked him not to dilute science.",
      "axes": {
        "logic_damage": 5,
        "straight_face": 5,
        "rewatch_value": 4,
        "crowd_complicity": 3,
        "consequence": 4
      },
      "verification": {
        "stage": "text_sourced",
        "best_source_tier": "B",
        "needs": [
          "full event recording with start/end timestamps and the surrounding 60 seconds"
        ],
        "sources": [
          {
            "tier": "C",
            "publisher": "Scroll.in",